productId;name;description;category;pricePerUnit;taxes_0_taxCode;taxes_0_taxName;taxes_0_taxRate;dimensions_weight;dimensions_weightUnit;dimensions_length;dimensions_lengthUnit;dimensions_width;dimensions_widthUnit;dimensions_height;dimensions_heightUnit;dimensions_volume;dimensions_volumeUnit;constraints_minUnit;constraints_stepSize;packaging_unit;packaging_unitName;packaging_packageName;packaging_packageUnit;packaging_amountPerPackage;packaging_boxName;packaging_boxUnit;packaging_amountPerBox;packaging_palletName;packaging_palletUnit;packaging_amountPerPallet;packaging_showFormatUnit;packaging_showFormatPackage;packaging_showFormatBox;group_name;group_description;variant_features_0_key;variant_features_0_value;variant_parentSku;variant_genericDisplayName;variant_index
PCA960CAFEMO2;ESMALTE AL AGUA COPPER CAFE;Esmalte al Agua Satinado con cobre antimicrobiano, rendimiento de 30 a 35 m² por galon con una mano, seca al tacto en 2 a 3 horas, repintado desde 4 horas, alta resistencia al lavado y desinfectantes, ideal para paredes y cielos interiores, contiene agente bacteriostatico, libre de metales pesados, estabilidad de 36 meses en envase cerrado,recomendado para espacios que requieren higiene y proteccion prolongada.;Esmalte al Agua;4890;IVACL;IVA;0.19;1.5;kg;11;cm;11;cm;13;cm;1573;cm³;6;6;1/4 GL;1/4 Galon;Display;DIS;6;Medio Pallet;MPA;228;Pallet;PAL;450;TRUE;FALSE;FALSE;Esmalte al Agua;;Color;CAFE;PCA960ECOPPBL2;ESMALTE AL AGUA COPPER 1/4 GALON;1
PCA960ECOPPBL2;ESMALTE AL AGUA COPPER BLANCO;Esmalte al Agua Satinado con cobre antimicrobiano, rendimiento de 30 a 35 m² por galon con una mano, seca al tacto en 2 a 3 horas, repintado desde 4 horas, alta resistencia al lavado y desinfectantes, ideal para paredes y cielos interiores, contiene agente bacteriostatico, libre de metales pesados, estabilidad de 36 meses en envase cerrado, recomendado para espacios que requieren higiene y proteccion prolongada.;Esmalte al Agua;4890;IVACL;IVA;0.19;1.5;kg;11;cm;11;cm;13;cm;1573;cm³;6;6;1/4 GL;1/4 Galon;Display;DIS;6;Medio Pallet;MPA;228;Pallet;PAL;450;TRUE;FALSE;FALSE;Esmalte al Agua;;Color;BLANCO;PCA960ECOPPBL2;ESMALTE AL AGUA COPPER 1/4 GALON;0
PANES930BL056;ESMALTE AL AGUA SEMIBRILLO 930 BLANCO;Esmalte agua Semi Brillo de imprimacion-terminacion, Rendimiento 35 ± 5 m2 por galon con una mano, Aplicacion Brocha, rodillo y pistola, Secado Tacto 2 – 3 horas, Repintado 3 – 6 horas. Especialmente formulada para ser aplicada sobre superficies de albañileria como estucos, ladrillos, hormigon. Tambien es recomendado para ser aplicado sobre tabiqueria, recubierta por plancha yeso-carton, plancha lisa y acanalada de fibrocemento.Uso interior y exterior.;Esmalte al Agua;52390;IVACL;IVA;0.19;25;kg;31;cm;31;cm;30;cm;29.01;cm³;1;1;BD4;Balde 4 Galones;Display;DIS;1;Medio Pallet;MPA;18;Pallet;PAL;36;TRUE;FALSE;FALSE;Esmalte al Agua;;Color;BLANCO;PANES930BL056;ESMALTE AL AGUA SEMIBRILLO 930 BALDE;0
PCA108INCO006;ESMALTE ANTICORROSIVO DOBLE ACCION BASE OSCURA;Anticorrosivo Doble Accion, imprimacion y terminacion en uno, base solvente con resina alquidica, acabado brillante y liso, rinde 45 ± 5 m² por galon por mano, secado al tacto en 3 a 4 horas y repintado desde 4 horas, alta resistencia a la humedad y a la radiacion UV, excelente adherencia y durabilidad, apto para interior y exterior, libre de metales pesados, estabilidad de 36 meses en envase cerrado, ideal para superficies de acero expuestas a condiciones moderadamente agresivas.;Metales;54000;IVACL;IVA;0.19;25;kg;31;cm;31;cm;30;cm;29.01;cm³;1;1;BD4;Balde 4 Galones;Display;DIS;1;Medio Pallet;MPA;18;Pallet;PAL;36;TRUE;FALSE;FALSE;Pintura para Metales;;Color;BASE OSCURA;PCA108NEGR006;ESMALTE ANTICORROSIVO DOBLE ACCION BALDE;1
PCA824PASELS6;PASTA ELASTICA BLANCA;Pasta para el recubrimiento de superficies de albañileria en general, en donde se desean disimular las imperfecciones de cielos rasos y muros, dejando una textura fina y suave. Rendimiento 15 m2 / Tineta / mano, sobre superficie lisa y sellada. No considera perdidas. Aplicacion Pistola para Pastas y Texturas, Llana y Espatula Metalica, secado tacto 2 a 3 horas y repintado de 4 a 6 horas. Adecuado para aplicar sobre estucos micro-fisurados, para ello se recomienda terminar con nuestro latex elastomerico. No se debe usar como material de reparacion ni de relleno. Este producto se puede aplicar en ambientes expuestos a humedad, en este caso terminar con esmalte al agua copper.;Pastas;26754;IVACL;IVA;0.19;25;kg;31;cm;31;cm;30;cm;29.01;cm³;1;1;BD4;Balde 4 Galones;Display;DIS;1;Medio Pallet;MPA;18;Pallet;PAL;36;TRUE;FALSE;FALSE;Pasta;;Color;BLANCO;PCA824PASELS6;PASTA ELASTICA BALDE;0
PCA824PASTA06;PASTA MURO;Pasta base agua formulada con resinas acrilicas en emulsion acuosa, carbonato de calcio y aditivos especiales. Ofrece un rendimiento teorico de 1 kg por m², segun espesor y rugosidad. Secado al tacto en 2 a 4 horas y lijado despues de 5 horas. Con un acabado mate, esta pasta es ideal para enmascarar, nivelar y decorar superficies interiores con imperfecciones, dejando una terminacion suave y lisa.;Pastas;14038;IVACL;IVA;0.19;25;kg;31;cm;31;cm;30;cm;29.01;cm³;1;1;BD4;Balde 4 Galones;Display;DIS;1;Medio Pallet;MPA;18;Pallet;PAL;36;TRUE;FALSE;FALSE;Pasta;;;;;;
PCA904BASIN06;OLEO SEMI BRILLO BASE OSCURA;Pintura base solvente con resina alquidica, acabado semi brillante, rinde 45 ± 5 m² por galon por mano, secado al tacto en 2 a 3 horas y repintado desde 3 horas, buena resistencia a la humedad, gran adherencia y durabilidad, apto para interior y exterior, libre de metales pesados, estabilidad de 36 meses en envase cerrado, ideal para superficies de madera solida y MDF expuestas a uso frecuente o condiciones exigentes.;Oleo;51490;IVACL;IVA;0.19;25;kg;31;cm;31;cm;30;cm;29.01;cm³;1;1;BD4;Balde 4 Galones;Display;DIS;1;Medio Pallet;MPA;18;Pallet;PAL;36;TRUE;FALSE;FALSE;Oleo;;Color;BASE OSCURA;PCA904BLAN056;OLEO SEMI BRILLO BALDE;1
PCA907BASE056;ZINC ACRYL BASE INCOLORA;Anticorrosivo base agua o Pintura para Zinc y Galvanizados con acabado satinado, rinde 30 m² por galon por mano, secado al tacto en 2 a 3 horas y repintado desde 3 horas, excelente poder cubridor y resistencia a la intemperie, se aplica con brocha, rodillo o pistola, diluible con agua, libre de metales pesados, estabilidad de 36 meses en envase cerrado, ideal para techos nuevos de zinc, galvanizado, zincalum y fibrocemento, protegiendolos de oxidacion, rayos UV y contaminacion ambiental.;Especialidades;42990;IVACL;IVA;0.19;25;kg;31;cm;31;cm;30;cm;29.01;cm³;1;1;BD4;Balde 4 Galones;Display;DIS;1;Medio Pallet;MPA;18;Pallet;PAL;36;TRUE;FALSE;FALSE;Pinturas Especiales;;Color;BASE INCOLORA;PCA907NEGRO06;ZINC ACRYL BALDE;1
PCA908BASIN06;IMPRIMANTE TEXTURA BASE INCOLORA;Pintura base agua formulada con resinas copolimero acrilico en emulsion acuosa, pigmentos organicos e inorganicos, aditivos especiales y extenders adecuados. Ofrece un rendimiento teorico de 35 ± 5 m² por galon y mano. Se seca al tacto en 2 a 4 horas y se puede repintar a partir de 6 horas. Ideal para uso interior y exterior, especialmente como acondicionador de superficies texturadas, dejando un acabado firme con absorcion uniforme.;Texturas;18436;IVACL;IVA;0.19;25;kg;31;cm;31;cm;30;cm;29.01;cm³;1;1;BD4;Balde 4 Galones;Display;DIS;1;Medio Pallet;MPA;18;Pallet;PAL;36;TRUE;FALSE;FALSE;Texturas;;Color;BASE INCOLORA;PCA912IMPTEX6;IMPRIMANTE TEXTURA BASE INCOLORA BALDE;1
PCA909BCOL006;ESTUCO HORMIGON BASE INCOLORA;Estuco hormigon base agua, formulado con resinas acrilicas, ideal para enmascarar, decorar e impermeabilizar superficies rigidas y neutras tanto en interiores como exteriores. Ofrece un acabado texturado, de alta adherencia sobre muros estucados, ladrillos, fibrocemento, madera, poliestireno expandido, y otros materiales flexibles. Rendimiento teorico de 10 a 12 m² por tineta, secado al tacto entre 2 y 4 horas, repintado desde 6 horas. No requiere dilucion y se aplica con llana metalica, rodillo o pistola texturadora. Producto libre de plomo, mercurio, cromo y metales pesados, cumpliendo con las normativas de atoxicidad ASTM-F-963 y EN-71-3. Estabilidad garantizada de 36 meses en envases cerrados.;Texturas;30294;IVACL;IVA;0.19;25;kg;31;cm;31;cm;30;cm;29.01;cm³;1;1;BD4;Balde 4 Galones;Display;DIS;1;Medio Pallet;MPA;18;Pallet;PAL;36;TRUE;FALSE;FALSE;Texturas;;Color;BASE INCOLORA;PCA909BLAN006;ESTUCO HORMIGON BASE INCOLORA BALDE;1
PCA909BLAN006;ESTUCO HORMIGON BLANCO;Estuco hormigon base agua, formulado con resinas acrilicas, ideal para enmascarar, decorar e impermeabilizar superficies rigidas y neutras tanto en interiores como exteriores. Ofrece un acabado texturado, de alta adherencia sobre muros estucados, ladrillos, fibrocemento, madera, poliestireno expandido, y otros materiales flexibles. Rendimiento teorico de 10 a 12 m² por tineta, secado al tacto entre 2 y 4 horas, repintado desde 6 horas. No requiere dilucion y se aplica con llana metalica, rodillo o pistola texturadora. Producto libre de plomo, mercurio, cromo y metales pesados, cumpliendo con las normativas de atoxicidad ASTM-F-963 y EN-71-3. Estabilidad garantizada de 36 meses en envases cerrados.;Texturas;46758;IVACL;IVA;0.19;25;kg;31;cm;31;cm;30;cm;29.01;cm³;1;1;BD4;Balde 4 Galones;Display;DIS;1;Medio Pallet;MPA;18;Pallet;PAL;36;TRUE;FALSE;FALSE;Texturas;;Color;BLANCO;PCA909BLAN006;ESTUCO HORMIGON BASE INCOLORA BALDE;0
PCA909G10BI06;ESTUCO ELASTOMERICO G-10 BASE INCOLORA;Estuco elastomerico base agua grano 10, ideal para superficies que experimentan alta dilatacion y contraccion en interiores y exteriores. Formulado con resinas elastomericas, pigmentos organicos e inorganicos y aditivos especiales, ofrece un acabado texturado. Rendimiento teorico de 10 a 12 m² por tineta, secado al tacto entre 2 y 4 horas, repintado desde 6 horas. No requiere dilucion y se aplica con llana metalica, rodillo o pistola. Producto libre de plomo, mercurio, cromo y metales pesados, cumpliendo con las normas de atoxicidad ASTM-F-963 y EN-71-3. Estabilidad garantizada de 36 meses en envases cerrados. Ideal para fibrocemento, madera, tableros de particulas y materiales flexibles.;Texturas;33000;IVACL;IVA;0.19;25;kg;31;cm;31;cm;30;cm;29.01;cm³;1;1;BD4;Balde 4 Galones;Display;DIS;1;Medio Pallet;MPA;18;Pallet;PAL;36;TRUE;FALSE;FALSE;Texturas;;Color;BASE INCOLORA;PCA909G10BL06;ESTUCO ELASTOMERICO G-10 BALDE;1
PCA909G10BL06;ESTUCO ELASTOMERICO G-10 BLANCO;Estuco elastomerico base agua grano 10, ideal para superficies que experimentan alta dilatacion y contraccion en interiores y exteriores. Formulado con resinas elastomericas, pigmentos organicos e inorganicos y aditivos especiales, ofrece un acabado texturado. Rendimiento teorico de 10 a 12 m² por tineta, secado al tacto entre 2 y 4 horas, repintado desde 6 horas. No requiere dilucion y se aplica con llana metalica, rodillo o pistola. Producto libre de plomo, mercurio, cromo y metales pesados, cumpliendo con las normas de atoxicidad ASTM-F-963 y EN-71-3. Estabilidad garantizada de 36 meses en envases cerrados. Ideal para fibrocemento, madera, tableros de particulas y materiales flexibles.;Texturas;36990;IVACL;IVA;0.19;25;kg;31;cm;31;cm;30;cm;29.01;cm³;1;1;BD4;Balde 4 Galones;Display;DIS;1;Medio Pallet;MPA;18;Pallet;PAL;36;TRUE;FALSE;FALSE;Texturas;;Color;BLANCO;PCA909G10BL06;ESTUCO ELASTOMERICO G-10 BALDE;0
PCA909G25BI06;ESTUCO ELASTOMERICO G-25 INCOLORO;Estuco elastomerico base agua grano 25, ideal para superficies que experimentan alta dilatacion y contraccion en interiores y exteriores. Formulado con resinas elastomericas, pigmentos organicos e inorganicos y aditivos especiales, ofrece un acabado texturado. Rendimiento teorico de 10 a 12 m² por tineta, secado al tacto entre 2 y 4 horas, repintado desde 6 horas. No requiere dilucion y se aplica con llana metalica, rodillo o pistola. Producto libre de plomo, mercurio, cromo y metales pesados, cumpliendo con las normas de atoxicidad ASTM-F-963 y EN-71-3. Estabilidad garantizada de 36 meses en envases cerrados. Ideal para fibrocemento, madera, tableros de particulas y materiales flexibles.;Texturas;32990;IVACL;IVA;0.19;25;kg;31;cm;31;cm;30;cm;29.01;cm³;1;1;BD4;Balde 4 Galones;Display;DIS;1;Medio Pallet;MPA;18;Pallet;PAL;36;TRUE;FALSE;FALSE;Texturas;;Color;INCOLORO;PCA909G25BL06;ESTUCO ELASTOMERICO G-25 BALDE;1
PCA909G25BL06;ESTUCO ELASTOMERICO G-25 BLANCO;Estuco elastomerico base agua grano 25, ideal para superficies que experimentan alta dilatacion y contraccion en interiores y exteriores. Formulado con resinas elastomericas, pigmentos organicos e inorganicos y aditivos especiales, ofrece un acabado texturado. Rendimiento teorico de 10 a 12 m² por tineta, secado al tacto entre 2 y 4 horas, repintado desde 6 horas. No requiere dilucion y se aplica con llana metalica, rodillo o pistola. Producto libre de plomo, mercurio, cromo y metales pesados, cumpliendo con las normas de atoxicidad ASTM-F-963 y EN-71-3. Estabilidad garantizada de 36 meses en envases cerrados. Ideal para fibrocemento, madera, tableros de particulas y materiales flexibles.;Texturas;37990;IVACL;IVA;0.19;25;kg;31;cm;31;cm;30;cm;29.01;cm³;1;1;BD4;Balde 4 Galones;Display;DIS;1;Medio Pallet;MPA;18;Pallet;PAL;36;TRUE;FALSE;FALSE;Texturas;;Color;BLANCO;PCA909G25BL06;ESTUCO ELASTOMERICO G-25 BALDE;0
PCA909TEXREN6;TEXTURENE G-10 BLANCO;Pasta texturada, Grano 10, de acabado mate, rendimiento 10 a 12 m2 por Balde de 4 galones, ideal para ambiente de interior o exterior. Apta para el enmascaramiento de imperfecciones en cielos rasos rigidos de hormigon-yeso, revestimiento de muros de albañileria en zonas secas de baja circulacion de personas.;Texturas;30225;IVACL;IVA;0.19;25;kg;31;cm;31;cm;30;cm;29.01;cm³;1;1;BD4;Balde 4 Galones;Display;DIS;1;Medio Pallet;MPA;18;Pallet;PAL;36;TRUE;FALSE;FALSE;Texturas;;Color;BLANCO;PCA909TEXREN6;TEXTURENE G-10 BALDE;0
PCA912EI10BL6;TEXTU EIFS G-10 BLANCO;Textura elastica grano 10, de aspecto pastoso y texturado base agua, para ser aplicado como terminacion en SISTEMA EIFS (aislacion termica), formulado en base a resinas elastomericas, rendimiento teorico entre 10 y 12 m2 por balde de 4 galones, secado tacto a 20ºC y 60% H.R. entre 2 y 4 horas, repintado en 6 horas minimo, aplicacion para Interior y Exterior, aplicacion en Llana metalica, Rodillo y Pistola texturadora.;Texturas, Aislacion EIFS;30990;IVACL;IVA;0.19;25;kg;31;cm;31;cm;30;cm;29.01;cm³;1;1;BD4;Balde 4 Galones;Display;DIS;1;Medio Pallet;MPA;18;Pallet;PAL;36;TRUE;FALSE;FALSE;Texturas;;Color;BLANCO;PCA912EI10BL6;TEXTU EIFS G-10 BALDE;0
PCA912EI25BL6;TEXTU EIFS G-25 BLANCO;Textura elastica grano 25, de aspecto pastoso y texturado base agua, para ser aplicado como terminacion en SISTEMA EIFS (aislacion termica), formulado en base a resinas elastomericas, rendimiento teorico entre 10 y 12 m2 por balde de 4 galones, secado tacto a 20ºC y 60% H.R. entre 2 y 4 horas, repintado en 6 horas minimo, aplicacion para Interior y Exterior, aplicacion en Llana metalica, Rodillo y Pistola texturadora.;Texturas, Aislacion EIFS;30990;IVACL;IVA;0.19;25;kg;31;cm;31;cm;30;cm;29.01;cm³;1;1;BD4;Balde 4 Galones;Display;DIS;1;Medio Pallet;MPA;18;Pallet;PAL;36;TRUE;FALSE;FALSE;Texturas;;Color;BLANCO;PCA912EI25BL6;TEXTU EIFS G-25 BALDE;0
PCA912EIFSIN6;TEXTU EIFS G-10 BASE INCOLORA;Textura elastica grano 10, de aspecto pastoso y texturado base agua, para ser aplicado como terminacion en SISTEMA EIFS (aislacion termica), formulado en base a resinas elastomericas, rendimiento teorico entre 10 y 12 m2 por balde de 4 galones, secado tacto a 20ºC y 60% H.R. entre 2 y 4 horas, repintado en 6 horas minimo, aplicacion para Interior y Exterior, aplicacion en Llana metalica, Rodillo y Pistola texturadora.;Texturas, Aislacion EIFS;28990;IVACL;IVA;0.19;25;kg;31;cm;31;cm;30;cm;29.01;cm³;1;1;BD4;Balde 4 Galones;Display;DIS;1;Medio Pallet;MPA;18;Pallet;PAL;36;TRUE;FALSE;FALSE;Texturas;;Color;BASE INCOLORA;PCA912EI10BL6;TEXTU EIFS G-10 BALDE;1
PCA912G25BIN6;TEXTU EIFS G-25 BASE INCOLORA;Textura elastica grano 25, de aspecto pastoso y texturado base agua, para ser aplicado como terminacion en SISTEMA EIFS (aislacion termica), formulado en base a resinas elastomericas, rendimiento teorico entre 10 y 12 m2 por balde de 4 galones, secado tacto a 20ºC y 60% H.R. entre 2 y 4 horas, repintado en 6 horas minimo, aplicacion para Interior y Exterior, aplicacion en Llana metalica, Rodillo y Pistola texturadora.;Texturas;28990;IVACL;IVA;0.19;25;kg;31;cm;31;cm;30;cm;29.01;cm³;1;1;BD4;Balde 4 Galones;Display;DIS;1;Medio Pallet;MPA;18;Pallet;PAL;36;TRUE;FALSE;FALSE;Texturas;;Color;BASE INCOLORA;PCA912EI25BL6;TEXTU EIFS G-25 BALDE;1
PCA912G10BI06;PROFINISH  G-10 BASE INCOLORA;Producto de aspecto pastoso y texturado base agua, Grano 10 ,especialmente formulado para enmascarar y decorar superficies neutras interiores y exteriores que posean imperfecciones, dejando una terminacion texturada. Rendimiento 10 a 12 m2 por balde de 4 galones, secado Tacto 2 a 4 horas, repintado 8 a 24 horas, ambiente Interior-Exterior, no requiere dilucion, aplicacion Llana metalica, Rodillo y Pistola texturadora.;Texturas, Aislacion EIFS;25990;IVACL;IVA;0.19;25;kg;31;cm;31;cm;30;cm;29.01;cm³;1;1;BD4;Balde 4 Galones;Display;DIS;1;Medio Pallet;MPA;18;Pallet;PAL;36;TRUE;FALSE;FALSE;Texturas;;Color;BASE INCOLORA;PCA912G10BLA6;PROFINISH G-10 BALDE;1
PCA912G10BLA6;PROFINISH G-10 BLANCO;Producto de aspecto pastoso y texturado base agua, Grano 10 ,especialmente formulado para enmascarar y decorar superficies neutras interiores y exteriores que posean imperfecciones, dejando una terminacion texturada. Rendimiento 10 a 12 m2 por balde de 4 galones, secado Tacto 2 a 4 horas, repintado 8 a 24 horas, ambiente Interior-Exterior, no requiere dilucion, aplicacion Llana metalica, Rodillo y Pistola texturadora.;Texturas, Aislacion EIFS;25990;IVACL;IVA;0.19;25;kg;31;cm;31;cm;30;cm;29.01;cm³;1;1;BD4;Balde 4 Galones;Display;DIS;1;Medio Pallet;MPA;18;Pallet;PAL;36;TRUE;FALSE;FALSE;Texturas;;Color;BLANCO;PCA912G10BLA6;PROFINISH G-10 BALDE;0
PCA912G25BI06;PROFINISH G-25 BASE INCOLORA;Producto de aspecto pastoso y texturado base agua, Grano 25 ,especialmente formulado para enmascarar y decorar superficies neutras interiores y exteriores que posean imperfecciones, dejando una terminacion texturada. Rendimiento 10 a 12 m2 por balde de 4 galones, secado Tacto 2 a 4 horas, repintado 8 a 24 horas, ambiente Interior-Exterior, no requiere dilucion, aplicacion Llana metalica, Rodillo y Pistola texturadora.;Texturas, Aislacion EIFS;25990;IVACL;IVA;0.19;25;kg;31;cm;31;cm;30;cm;29.01;cm³;1;1;BD4;Balde 4 Galones;Display;DIS;1;Medio Pallet;MPA;18;Pallet;PAL;36;TRUE;FALSE;FALSE;Texturas;;Color;BASE INCOLORA;PCA912G25BL06;PROFINISH G-25 BALDE;1
PCA912G25BL06;PROFINISH G-25 BLANCO;Producto de aspecto pastoso y texturado base agua, Grano 25 ,especialmente formulado para enmascarar y decorar superficies neutras interiores y exteriores que posean imperfecciones, dejando una terminacion texturada. Rendimiento 10 a 12 m2 por balde de 4 galones, secado Tacto 2 a 4 horas, repintado 8 a 24 horas, ambiente Interior-Exterior, no requiere dilucion, aplicacion Llana metalica, Rodillo y Pistola texturadora.;Texturas, Aislacion EIFS;28990;IVACL;IVA;0.19;25;kg;31;cm;31;cm;30;cm;29.01;cm³;1;1;BD4;Balde 4 Galones;Display;DIS;1;Medio Pallet;MPA;18;Pallet;PAL;36;TRUE;FALSE;FALSE;Texturas;;Color;BLANCO;PCA912G25BL06;PROFINISH G-25 BALDE;0
PCA912IMPTEX6;IMPRIMANTE TEXTURA BLANCO;Pintura base agua formulada con resinas copolimero acrilico en emulsion acuosa, pigmentos organicos e inorganicos, aditivos especiales y extenders adecuados. Ofrece un rendimiento teorico de 35 ± 5 m² por galon y mano. Se seca al tacto en 2 a 4 horas y se puede repintar a partir de 6 horas. Ideal para uso interior y exterior, especialmente como acondicionador de superficies texturadas, dejando un acabado firme con absorcion uniforme.;Texturas;24522;IVACL;IVA;0.19;25;kg;31;cm;31;cm;30;cm;29.01;cm³;1;1;BD4;Balde 4 Galones;Display;DIS;1;Medio Pallet;MPA;18;Pallet;PAL;36;TRUE;FALSE;FALSE;Texturas;;Color;BLANCO;PCA912IMPTEX6;IMPRIMANTE TEXTURA BASE INCOLORA BALDE;0
PCA916LOSA006;PASTA LOSA PLUS;Pasta texturizadora base agua formulada con resinas acrilicas en emulsion acuosa, pigmentos inorganicos, aditivos reologicos y extenders adecuados. Ofrece un rendimiento de 15 m² por tineta y mano sobre superficie lisa y sellada. Secado rapido al tacto en 2 a 3 horas y repintado en 3 a 6 horas. Su acabado mate con efecto goteado proporciona una textura fina y suave, ideal para disimular imperfecciones en cielos rasos y muros interiores.;Pastas;24273;IVACL;IVA;0.19;25;kg;31;cm;31;cm;30;cm;29.01;cm³;1;1;BD4;Balde 4 Galones;Display;DIS;1;Medio Pallet;MPA;18;Pallet;PAL;36;TRUE;FALSE;FALSE;Pasta;;;;;;
PCA920INCOBR6;SELLADOR PAPEL COPPER;Sellador para papel base agua, formulado en base a resinas acrilicas en emulsion acuosa con nanoparticulas de cobre, producto formulado para sellar y uniformar la absorcion de superfices como muros de estuco, hormigon, ladrillo, tableros de madera y fibrocemento. Este imprimante es especial para prevenir la formacion de hongos bajo el papel mural, gracias a las nanoparticulas de cobre, para uso e interior y exterior. Rinde entre 100-120 m2/balde/mano. Aplicable con borcha rodillo y pistola. Tiempo de secado al tacto y repintado de 2 a 3 hrs. Dilucion maxima de 20% a 30% con agua potable.;Selladores;24874;IVACL;IVA;0.19;25;kg;31;cm;31;cm;30;cm;29.01;cm³;1;1;BD4;Balde 4 Galones;Display;DIS;1;Medio Pallet;MPA;18;Pallet;PAL;36;TRUE;FALSE;FALSE;Sellador;;;;;;
PCA922BOSC056;ESMALTE SINTETICO BASE OSCURA;Esmalte Sintetico Brillante, pintura base solvente con resina alquidica, acabado brillante de alta resistencia, rinde 45 ± 5 m² por galon por mano, secado al tacto en 2 a 3 horas y repintado desde 3 horas, excelente adherencia, flexibilidad y durabilidad, resistente a la humedad y radiacion UV, apto para interior y exterior, libre de metales pesados, estabilidad de 36 meses en envase cerrado, ideal para terminaciones sobre superficies de madera o metal previamente imprimadas.;Metales;49990;IVACL;IVA;0.19;25;kg;31;cm;31;cm;30;cm;29.01;cm³;1;1;BD4;Balde 4 Galones;Display;DIS;1;Medio Pallet;MPA;18;Pallet;PAL;36;TRUE;FALSE;FALSE;Pintura para Metales;;Color;BASE OSCURA;PCA922BLAN056;ESMALTE SINTETICO BALDE;2
PCA925BLAN056;HIDRO COPPER BLANCO;Pintura base agua de alta calidad formulada con resinas acrilicas en emulsion acuosa, aditivos hidro-repelentes, fungicidas y nano-particulas de cobre con accion microbicida. Ofrece un rendimiento de 35 ± 5 m² por galon con una sola mano de aplicacion. Se seca al tacto en 2 a 3 horas a 20°C y 60% de humedad relativa, y puede ser repintada en 3 a 6 horas. Ideal para uso interior y exterior, especialmente en superficies de fibrocemento (siding y tinglado), estucos, ladrillos, hormigon y pisos de cemento.;Especialidades;47832;IVACL;IVA;0.19;25;kg;31;cm;31;cm;30;cm;29.01;cm³;1;1;BD4;Balde 4 Galones;Display;DIS;1;Medio Pallet;MPA;18;Pallet;PAL;36;TRUE;FALSE;FALSE;Pinturas Especiales;;Color;BLANCO;PCA925BLAN056;HIDRO COPPER BALDE;0
PCA927BLANCO6;LATEX ELASTOMERICO BLANCO;Latex de Aparejo y Terminacion, ideal para zonas con micro frisuras por su capacidad elastica, con acabado mate, rendimiento  35 ± 5 m2 por galon con una mano, aplicacion brocha, rodillo y pistola, secado tacto entre 2 – 3 horas, repintado entre  3 – 6 horas. Especialmente formulada para ser aplicada sobre superficies de albañileria como estucos, ladrillos, hormigon. Tambien es recomendado para ser aplicado sobre tabiqueria, recubierta por plancha yeso-carton, plancha lisa y acanalada.;Latex;35300;IVACL;IVA;0.19;25;kg;31;cm;31;cm;30;cm;29.01;cm³;1;1;BD4;Balde 4 Galones;Display;DIS;1;Medio Pallet;MPA;18;Pallet;PAL;36;TRUE;FALSE;FALSE;Latex;;Color;BLANCO;PCA927BLANCO6;LATEX ELASTOMERICO BALDE;0
PCA929BOSC06;LATEX SUPER CUBRIENTE BASE OSCURA;Latex Super Cubriente de Aparejo y Terminacion Premium, con acabado mate, rendimiento  35 ± 5 m2 por galon con una mano, aplicacion brocha, rodillo y pistola, secado tacto entre 2 – 3 horas, repintado entre  3 – 6 horas. Especialmente formulada para ser aplicada sobre superficies de albañileria como estucos, ladrillos, hormigon. Tambien es recomendado para ser aplicado sobre tabiqueria, recubierta por plancha yeso-carton, plancha lisa y acanalada de fibrocemento.;Latex;23178;IVACL;IVA;0.19;25;kg;31;cm;31;cm;30;cm;29.01;cm³;1;1;BD4;Balde 4 Galones;Display;DIS;1;Medio Pallet;MPA;18;Pallet;PAL;36;TRUE;FALSE;FALSE;Latex;;Color;BASE OSCURA;PCAEXTRACUB06;LATEX SUPER CUBRIENTE BALDE;1
PCA950PESTU06;PASTA ESTUCRYL;Pasta base agua formulada con resinas acrilicas en emulsion acuosa, pigmentos organicos e inorganicos, y aditivos especiales. Ofrece un rendimiento de 1,5 kg de mezcla con cemento por cada mm de espesor y por m². Secado rapido al tacto en 2 a 3 horas y repintado en 6 horas minimo. Su acabado mate proporciona una excelente resistencia a la humedad, siendo ideal para estucar, reparar o enlucir muros de estuco, albañileria, ladrillos, OSB y otros materiales utilizados en construccion.;Pastas;14360;IVACL;IVA;0.19;25;kg;31;cm;31;cm;30;cm;29.01;cm³;1;1;BD4;Balde 4 Galones;Display;DIS;1;Medio Pallet;MPA;18;Pallet;PAL;36;TRUE;FALSE;FALSE;Pasta;;;;;;
PCA952ELEIFS6;PASTA ADHESIVA EIFS;Revestimiento pastoso preparado con resinas acrilicas modificadas y silice, diseñado para nivelar muros exteriores en combinacion con mallas de fibra de vidrio. Se aplica mezclando 1,5 kg de la pasta con cemento por cada mm de espesor por m². El rendimiento con malla incorporada es de 3 kg por m² en superficies planas (dos manos). Secado rapido y con excelente adherencia sobre hormigon, albañileria y otros materiales constructivos.;Pastas, Aislacion EIFS;16081;IVACL;IVA;0.19;25;kg;31;cm;31;cm;30;cm;29.01;cm³;1;1;BD4;Balde 4 Galones;Display;DIS;1;Medio Pallet;MPA;18;Pallet;PAL;36;TRUE;FALSE;FALSE;Pasta;;;;;;
